CVE ID,Description,CVSS,Date,References
CVE-2022-32199,db_convert.php in ScriptCase through 9.9.008 is vulnerable to Arbitrary File Deletion by an admin via a directory traversal sequence in the file parameter.,,27-03-2023 06:15,https://github.com/Toxich4/CVE-2022-32199
CVE-2022-4126,"Use of Default Password vulnerability in ABB RCCMD on Windows, Linux, MacOS allows Try Common or Default Usernames and Passwords.This issue affects RCCMD: before 4.40 230207.",,27-03-2023 05:15,https://search.abb.com/library/Download.aspx?DocumentID=2CMT006099_EN&LanguageCode=en&DocumentPartId=&Action=Launch
CVE-2023-28885,The MyLink infotainment system (build 2021.3.26) in General Motors Chevrolet Equinox 2021 vehicles allows attackers to cause a denial of service (temporary failure of Media Player functionality) via a crafted MP3 file.,,27-03-2023 04:15,https://github.com/zj3t/GM_Vulnerability
CVE-2023-25909,HGiga OAKlouds file uploading function does not restrict upload of file with dangerous type. An unauthenticated remote attacker can exploit this vulnerability to upload and run arbitrary executable files to perform arbitrary command or disrupt service.,9.8,27-03-2023 04:15,https://www.twcert.org.tw/tw/cp-132-6973-45872-1.html
CVE-2023-25018,RIFARTEK IOT Wall transportation function has insufficient filtering for user input. An authenticated remote attacker with general user privilege can inject JavaScript to perform reflected XSS (Reflected Cross-site scripting) attack.,5.4,27-03-2023 04:15,https://www.twcert.org.tw/tw/cp-132-6963-7d2ee-1.html
CVE-2023-25017,RIFARTEK IOT Wall has a vulnerability of incorrect authorization. An authenticated remote attacker with general user privilege is allowed to perform specific privileged function to access and modify all sensitive data.,8.1,27-03-2023 04:15,https://www.twcert.org.tw/tw/cp-132-6962-34ac1-1.html
CVE-2023-24842,HGiga MailSherlock has vulnerability of insufficient access control. An unauthenticated remote user can exploit this vulnerability to access partial content of another user’s mail by changing user ID and mail ID within URL.,5.3,27-03-2023 04:15,https://www.twcert.org.tw/tw/cp-132-6961-12444-1.html
CVE-2023-24841,HGiga MailSherlock query function for connection log has a vulnerability of insufficient filtering for user input. An authenticated remote attacker with administrator privilege can exploit this vulnerability to inject and execute arbitrary system commands to perform arbitrary system operation or disrupt service.,7.2,27-03-2023 04:15,https://www.twcert.org.tw/tw/cp-132-6960-fc2fe-1.html
CVE-2023-24840,"HGiga MailSherlock mail query function has vulnerability of insufficient validation for user input. An authenticated remote attacker with administrator privilege can exploit this vulnerability to inject SQL commands to read, modify, and delete the database.",7.2,27-03-2023 04:15,https://www.twcert.org.tw/tw/cp-132-6959-cdecb-1.html
CVE-2023-24839,"HGiga MailSherlock’s specific function has insufficient filtering for user input. An unauthenticated remote attacker can exploit this vulnerability to inject JavaScript, conducting a reflected XSS attack.",6.1,27-03-2023 04:15,https://www.twcert.org.tw/tw/cp-132-6958-e1a8e-1.html
CVE-2023-24838,"HGiga PowerStation has a vulnerability of Information Leakage. An unauthenticated remote attacker can exploit this vulnerability to obtain the administrator’s credential, resulting in performing arbitrary system operation or disrupt service.",9.8,27-03-2023 04:15,https://www.twcert.org.tw/tw/cp-132-6957-d8f67-1.html
CVE-2023-24837,HGiga PowerStation remote management function has insufficient filtering for user input. An authenticated remote attacker with general user privilege can exploit this vulnerability to inject and execute arbitrary system commands to perform arbitrary system operation or disrupt service.,8.8,27-03-2023 04:15,https://www.twcert.org.tw/tw/cp-132-6956-fbd85-1.html
CVE-2023-24835,Softnext Technologies Corp.’s SPAM SQR has a vulnerability of Code Injection within its specific function. An authenticated remote attacker with administrator privilege can exploit this vulnerability to execute arbitrary system command to perform arbitrary system operation or disrupt service.,7.2,27-03-2023 04:15,https://www.twcert.org.tw/tw/cp-132-6955-c7612-1.html
CVE-2023-24834,WisdomGarden Tronclass has improper access control when uploading file. An authenticated remote attacker with general user privilege can exploit this vulnerability to access files belonging to other users by modifying the file ID within URL.,6.5,27-03-2023 04:15,https://www.twcert.org.tw/tw/cp-132-6954-ed16b-1.html
CVE-2023-22902,"Openfind Mail2000 file uploading function has insufficient filtering for user input. An authenticated remote attacker with general user privilege can exploit this vulnerability to inject JavaScript, conducting an XSS attack.",5.4,27-03-2023 04:15,https://www.twcert.org.tw/tw/cp-132-6953-79236-1.html
CVE-2022-39043,Juiker app stores debug logs which contains sensitive information to mobile external storage. An unauthenticated physical attacker can access these files to acquire partial user information such as personal contacts.,2.4,27-03-2023 04:15,https://www.twcert.org.tw/tw/cp-132-6922-4a37a-1.html
CVE-2023-28884,"In MISP 2.4.169, app/Lib/Tools/CustomPaginationTool.php allows XSS in the community index.",,27-03-2023 03:15,https://github.com/MISP/MISP/commit/b94c7978e5e6b1db369abeedbbf00bca975b08b7
CVE-2023-28883,"In Cerebrate 1.13, a blind SQL injection exists in the searchAll API endpoint.",,27-03-2023 03:15,https://github.com/cerebrate-project/cerebrate/commit/5f1c99cd534442ec40c2129769608e3e61ff8be3
CVE-2018-25083,The pullit package before 1.4.0 for Node.js allows OS Command Injection because eval is used on an attacker-supplied Git branch name.,,27-03-2023 03:15,https://security.snyk.io/vuln/npm:pullit:20180214
CVE-2023-28867,"In GraphQL Java (aka graphql-java) before 20.1, an attacker can send a crafted GraphQL query that causes stack consumption. The fixed versions are 20.1, 19.4, 18.4, 17.5, and 0.0.0-2023-03-20T01-49-44-80e3135.",,27-03-2023 01:15,https://github.com/graphql-java/graphql-java/pull/3112
CVE-2023-28866,"In the Linux kernel through 6.2.8, net/bluetooth/hci_sync.c allows out-of-bounds access because amp_init1[] and amp_init2[] are supposed to have an intentionally invalid element, but do not.",,27-03-2023 01:15,https://lore.kernel.org/lkml/20230321015018.1759683-1-iam@sung-woo.kim/
CVE-2023-1647,Improper Access Control in GitHub repository calcom/cal.com prior to 2.7.,,27-03-2023 01:15,https://huntr.dev/bounties/d6de3d6e-9551-47d1-b28c-7e965c1b82b6
CVE-2023-1646,A vulnerability was found in IObit Malware Fighter 9.4.0.776. It has been declared as critical. This vulnerability affects the function 0x8018E000/0x8018E004 in the library IMFCameraProtect.sys of the component IOCTL Handler. The manipulation leads to stack-based buffer overflow. An attack has to be approached locally. The exploit has been disclosed to the public and may be used. VDB-224026 is the identifier assigned to this vulnerability.,,26-03-2023 23:15,https://vuldb.com/?ctiid.224026
CVE-2023-1645,A vulnerability was found in IObit Malware Fighter 9.4.0.776. It has been classified as problematic. This affects the function 0x8018E008 in the library IMFCameraProtect.sys of the component IOCTL Handler. The manipulation leads to denial of service. The attack needs to be approached locally. The exploit has been disclosed to the public and may be used. The identifier VDB-224025 was assigned to this vulnerability.,,26-03-2023 23:15,https://vuldb.com/?ctiid.224025
CVE-2023-1644,A vulnerability was found in IObit Malware Fighter 9.4.0.776 and classified as problematic. Affected by this issue is the function 0x8018E010 in the library IMFCameraProtect.sys of the component IOCTL Handler. The manipulation leads to denial of service. It is possible to launch the attack on the local host. The exploit has been disclosed to the public and may be used. The identifier of this vulnerability is VDB-224024.,,26-03-2023 23:15,https://vuldb.com/?ctiid.224024
CVE-2023-1643,A vulnerability has been found in IObit Malware Fighter 9.4.0.776 and classified as problematic. Affected by this vulnerability is the function 0x8001E000/0x8001E004/0x8001E018/0x8001E01C/0x8001E024/0x8001E040 in the library ImfHpRegFilter.sys of the component IOCTL Handler. The manipulation leads to denial of service. Attacking locally is a requirement. The exploit has been disclosed to the public and may be used. The associated identifier of this vulnerability is VDB-224023.,,26-03-2023 22:15,https://vuldb.com/?ctiid.224023
CVE-2023-1642,"A vulnerability, which was classified as problematic, was found in IObit Malware Fighter 9.4.0.776. Affected is the function 0x222034/0x222038/0x22203C/0x222040 in the library ObCallbackProcess.sys of the component IOCTL Handler. The manipulation leads to denial of service. Local access is required to approach this attack. The exploit has been disclosed to the public and may be used. VDB-224022 is the identifier assigned to this vulnerability.",,26-03-2023 22:15,https://vuldb.com/?id.224022
CVE-2023-1641,"A vulnerability, which was classified as problematic, has been found in IObit Malware Fighter 9.4.0.776. This issue affects the function 0x222018 in the library ObCallbackProcess.sys of the component IOCTL Handler. The manipulation leads to denial of service. An attack has to be approached locally. The exploit has been disclosed to the public and may be used. The identifier VDB-224021 was assigned to this vulnerability.",,26-03-2023 22:15,https://vuldb.com/?id.224021
CVE-2023-1640,A vulnerability classified as problematic was found in IObit Malware Fighter 9.4.0.776. This vulnerability affects the function 0x222010 in the library ObCallbackProcess.sys of the component IOCTL Handler. The manipulation leads to denial of service. The attack needs to be approached locally. The exploit has been disclosed to the public and may be used. The identifier of this vulnerability is VDB-224020.,,26-03-2023 22:15,https://github.com/zeze-zeze/WindowsKernelVuln/tree/master/unassigned34
CVE-2023-27796,"RG-EW1200G PRO Wireless Routers EW_3.0(1)B11P204, RG-EW1800GX PRO Wireless Routers EW_3.0(1)B11P204, and RG-EW3200GX PRO Wireless Routers EW_3.0(1)B11P204 were discovered to contain multiple command injection vulnerabilities via the data.ip, data.protocal, data.iface and data.package parameters in the runPackDiagnose function of diagnose.lua.",,26-03-2023 21:15,https://github.com/winmt/my-vuls/tree/main/RG-EW%20PRO%20Series
CVE-2023-26802,An issue in the component /network_config/nsg_masq.cgi of DCN (Digital China Networks) DCBI-Netlog-LAB v1.0 allows attackers to bypass authentication and execute arbitrary commands via a crafted request.,,26-03-2023 21:15,https://github.com/winmt/my-vuls/tree/main/DCN%20DCBI-Netlog-LAB
CVE-2023-26801,"LB-LINK BL-AC1900_2.0 v1.0.1, LB-LINK BL-WR9000 v2.4.9, LB-LINK BL-X26 v1.2.5, and LB-LINK BL-LTE300 v1.0.8 were discovered to contain a command injection vulnerability via the mac, time1, and time2 parameters at /goform/set_LimitClient_cfg.",,26-03-2023 21:15,https://github.com/winmt/my-vuls/tree/main/LB-LINK%20BL-AC1900%2C%20BL-WR9000%2C%20BL-X26%20and%20BL-LTE300%20Wireless%20Routers
CVE-2023-26800,Ruijie Networks RG-EW1200 Wireless Routers EW_3.0(1)B11P204 was discovered to contain a command injetion vulnerability via the params.path parameter in the upgradeConfirm function.,,26-03-2023 21:15,https://github.com/winmt/my-vuls/tree/main/RG-EW1200
CVE-2023-1639,A vulnerability classified as problematic has been found in IObit Malware Fighter 9.4.0.776. This affects the function 0x8001E04C in the library ImfRegistryFilter.sys of the component IOCTL Handler. The manipulation leads to denial of service. It is possible to launch the attack on the local host. The exploit has been disclosed to the public and may be used. The associated identifier of this vulnerability is VDB-224019.,,26-03-2023 21:15,https://github.com/zeze-zeze/WindowsKernelVuln/tree/master/unassigned33
CVE-2023-1638,A vulnerability was found in IObit Malware Fighter 9.4.0.776. It has been rated as problematic. Affected by this issue is the function 0x8001E024/0x8001E040 in the library ImfRegistryFilter.sys of the component IOCTL Handler. The manipulation leads to denial of service. Attacking locally is a requirement. The exploit has been disclosed to the public and may be used. VDB-224018 is the identifier assigned to this vulnerability.,,26-03-2023 21:15,https://drive.google.com/file/d/1_jYlCkQMNaUwGV5QJtyz4zhdTqaGCv6Z/view
CVE-2023-28859,"redis-py through 4.5.3 leaves a connection open after canceling an async Redis command at an inopportune time (in the case of a non-pipeline operation), and can send response data to the client of an unrelated request. NOTE: this issue exists because of an incomplete fix for CVE-2023-28858.",,26-03-2023 19:15,https://github.com/redis/redis-py/pull/2641
CVE-2023-28858,"redis-py before 4.5.3, as used in ChatGPT and other products, leaves a connection open after canceling an async Redis command at an inopportune time (in the case of a pipeline operation), and can send response data to the client of an unrelated request in an off-by-one manner. The fixed versions for this CVE Record are 4.3.6, 4.4.3, and 4.5.3; however, CVE-2023-28859 is a separate vulnerability.",,26-03-2023 19:15,https://github.com/redis/redis-py/compare/v4.3.5...v4.3.6
CVE-2023-1458,** DISPUTED ** A vulnerability has been found in Ubiquiti EdgeRouter X 2.0.9-hotfix.6 and classified as critical. Affected by this vulnerability is an unknown functionality of the component OSPF Handler. The manipulation of the argument area leads to command injection. The attack can be launched remotely. The exploit has been disclosed to the public and may be used. The real existence of this vulnerability is still doubted at the moment. The associated identifier of this vulnerability is VDB-223303. NOTE: The vendor position is that post-authentication issues are not accepted as vulnerabilities.,,25-03-2023 22:15,https://vuldb.com/?id.223303
CVE-2023-1457,"** DISPUTED ** A vulnerability, which was classified as critical, was found in Ubiquiti EdgeRouter X 2.0.9-hotfix.6. Affected is an unknown function of the component Static Routing Configuration Handler. The manipulation of the argument next-hop-interface leads to command injection. It is possible to launch the attack remotely. The exploit has been disclosed to the public and may be used. The real existence of this vulnerability is still doubted at the moment. VDB-223302 is the identifier assigned to this vulnerability. NOTE: The vendor position is that post-authentication issues are not accepted as vulnerabilities.",,25-03-2023 21:15,https://vuldb.com/?ctiid.223302
CVE-2023-1456,"A vulnerability, which was classified as critical, has been found in Ubiquiti EdgeRouter X 2.0.9-hotfix.6. This issue affects some unknown processing of the component NAT Configuration Handler. The manipulation leads to command injection. The attack may be initiated remotely. The exploit has been disclosed to the public and may be used. The real existence of this vulnerability is still doubted at the moment. The identifier VDB-223301 was assigned to this vulnerability. NOTE: The vendor position is that post-authentication issues are not accepted as vulnerabilities.",,25-03-2023 21:15,https://vuldb.com/?ctiid.223301
CVE-2023-1635,A vulnerability was found in OTCMS 6.72. It has been declared as problematic. Affected by this vulnerability is the function AutoRun of the file apiRun.php. The manipulation of the argument mode leads to cross site scripting. The attack can be launched remotely. The identifier VDB-224017 was assigned to this vulnerability.,,25-03-2023 19:15,https://github.com/BigTiger2020/2023/blob/main/XSS.md
CVE-2023-1634,A vulnerability was found in OTCMS 6.72. It has been classified as critical. Affected is the function UseCurl of the file /admin/info_deal.php of the component URL Parameter Handler. The manipulation leads to server-side request forgery. It is possible to launch the attack remotely. The exploit has been disclosed to the public and may be used. The identifier of this vulnerability is VDB-224016.,,25-03-2023 19:15,https://vuldb.com/?ctiid.224016
CVE-2016-15030,A vulnerability classified as problematic has been found in Arno0x TwoFactorAuth. This affects an unknown part of the file login/login.php. The manipulation of the argument from leads to open redirect. It is possible to initiate the attack remotely. This product does not use versioning. This is why information about affected and unaffected releases are unavailable. The name of the patch is 8549ad3cf197095f783643e41333586d6a4d0e54. It is recommended to apply a patch to fix this issue. The associated identifier of this vulnerability is VDB-223803.,,25-03-2023 18:15,https://vuldb.com/?id.223803
CVE-2015-10097,A vulnerability was found in grinnellplans-php up to 3.0. It has been declared as critical. Affected by this vulnerability is the function interface_disp_page/interface_disp_page of the file read.php. The manipulation leads to sql injection. The attack can be launched remotely. The name of the patch is 57e4409e19203a94495140ff1b5a697734d17cfb. It is recommended to apply a patch to fix this issue. The identifier VDB-223801 was assigned to this vulnerability.,,25-03-2023 18:15,https://github.com/grinnellplans/grinnellplans-php/commit/57e4409e19203a94495140ff1b5a697734d17cfb
CVE-2023-1632,** DISPUTED ** A vulnerability has been found in Ellucian Banner Web Tailor 8.6 and classified as critical. This vulnerability affects unknown code of the file /PROD_ar/twbkwbis.P_FirstMenu of the component Login Page. The manipulation of the argument PIDM/WEBID leads to improper authorization. The attack can be initiated remotely. After submitting proper login credentials it becomes possible to generate new valid session identifiers on the OTP page. The real existence of this vulnerability is still doubted at the moment. VDB-224014 is the identifier assigned to this vulnerability.,,25-03-2023 17:15,https://vuldb.com/?ctiid.224014
CVE-2023-1631,"A vulnerability, which was classified as problematic, was found in JiangMin Antivirus 16.2.2022.418. This affects the function 0x222010 in the library kvcore.sys of the component IOCTL Handler. The manipulation leads to null pointer dereference. Attacking locally is a requirement. The exploit has been disclosed to the public and may be used. The identifier VDB-224013 was assigned to this vulnerability.",,25-03-2023 12:15,https://drive.google.com/file/d/1Div9mElTdsluLrU2etziLYqmXcqQFj1j/view
CVE-2023-1630,"A vulnerability, which was classified as problematic, has been found in JiangMin Antivirus 16.2.2022.418. Affected by this issue is the function 0x222000 in the library kvcore.sys of the component IOCTL Handler. The manipulation leads to denial of service. Local access is required to approach this attack. The exploit has been disclosed to the public and may be used. The identifier of this vulnerability is VDB-224012.",,25-03-2023 12:15,https://vuldb.com/?ctiid.224012
CVE-2023-1628,A vulnerability classified as problematic has been found in Jianming Antivirus 16.2.2022.418. Affected is an unknown function in the library kvcore.sys of the component IoControlCode Handler. The manipulation leads to null pointer dereference. The attack needs to be approached locally. The exploit has been disclosed to the public and may be used. VDB-224010 is the identifier assigned to this vulnerability.,,25-03-2023 12:15,https://drive.google.com/file/d/1Div9mElTdsluLrU2etziLYqmXcqQFj1j/view
CVE-2023-1627,A vulnerability was found in Jianming Antivirus 16.2.2022.418. It has been rated as problematic. This issue affects some unknown processing in the library kvcore.sys of the component IoControlCode Handler. The manipulation leads to denial of service. It is possible to launch the attack on the local host. The exploit has been disclosed to the public and may be used. The identifier VDB-224009 was assigned to this vulnerability.,,25-03-2023 12:15,https://drive.google.com/file/d/1fQFw8ayQUFzJM2_4V-ld8CN8gvisVoiu/view
CVE-2023-1626,A vulnerability was found in Jianming Antivirus 16.2.2022.418. It has been declared as critical. This vulnerability affects unknown code in the library kvcore.sys of the component IoControlCode Handler. The manipulation leads to memory corruption. Attacking locally is a requirement. The exploit has been disclosed to the public and may be used. The identifier of this vulnerability is VDB-224008.,,25-03-2023 12:15,https://github.com/zeze-zeze/WindowsKernelVuln/tree/master/unassigned31
CVE-2023-1629,A vulnerability classified as critical was found in JiangMin Antivirus 16.2.2022.418. Affected by this vulnerability is the function 0x222010 in the library kvcore.sys of the component IOCTL Handler. The manipulation leads to memory corruption. An attack has to be approached locally. The exploit has been disclosed to the public and may be used. The associated identifier of this vulnerability is VDB-224011.,,25-03-2023 11:16,https://vuldb.com/?id.224011
CVE-2023-28437,Dataease is an open source data visualization and analysis tool. The blacklist for SQL injection protection is missing entries. This vulnerability has been fixed in version 1.18.5. There are no known workarounds.,,25-03-2023 00:15,https://github.com/dataease/dataease/issues/4795
CVE-2023-27579,TensorFlow is an end-to-end open source platform for machine learning. Constructing a tflite model with a paramater `filter_input_channel` of less than 1 gives a FPE. This issue has been patched in version 2.12. TensorFlow will also cherrypick the fix commit on TensorFlow 2.11.1.,,25-03-2023 00:15,https://github.com/tensorflow/tensorflow/commit/34f8368c535253f5c9cb3a303297743b62442aaa
CVE-2023-25801,"TensorFlow is an open source machine learning platform. Prior to versions 2.12.0 and 2.11.1, `nn_ops.fractional_avg_pool_v2` and `nn_ops.fractional_max_pool_v2` require the first and fourth elements of their parameter `pooling_ratio` to be equal to 1.0, as pooling on batch and channel dimensions is not supported. A fix is included in TensorFlow 2.12.0 and 2.11.1.",,25-03-2023 00:15,https://github.com/tensorflow/tensorflow/security/advisories/GHSA-f49c-87jh-g47q
CVE-2023-25676,"TensorFlow is an open source machine learning platform. When running versions prior to 2.12.0 and 2.11.1 with XLA, `tf.raw_ops.ParallelConcat` segfaults with a nullptr dereference when given a parameter `shape` with rank that is not greater than zero. A fix is available in TensorFlow 2.12.0 and 2.11.1.",,25-03-2023 00:15,https://github.com/tensorflow/tensorflow/security/advisories/GHSA-6wfh-89q8-44jq
CVE-2023-25675,"TensorFlow is an open source machine learning platform. When running versions prior to 2.12.0 and 2.11.1 with XLA, `tf.raw_ops.Bincount` segfaults when given a parameter `weights` that is neither the same shape as parameter `arr` nor a length-0 tensor. A fix is included in TensorFlow 2.12.0 and 2.11.1.",,25-03-2023 00:15,https://github.com/tensorflow/tensorflow/commit/8ae76cf085f4be26295d2ecf2081e759e04b8acf
CVE-2023-25674,TensorFlow is an open source machine learning platform. Versions prior to 2.12.0 and 2.11.1 have a null pointer error in RandomShuffle with XLA enabled. A fix is included in TensorFlow 2.12.0 and 2.11.1.,,25-03-2023 00:15,https://github.com/tensorflow/tensorflow/security/advisories/GHSA-gf97-q72m-7579
CVE-2023-25673,TensorFlow is an open source platform for machine learning. Versions prior to 2.12.0 and 2.11.1 have a Floating Point Exception in TensorListSplit with XLA. A fix is included in TensorFlow version 2.12.0 and version 2.11.1.,,25-03-2023 00:15,https://github.com/tensorflow/tensorflow/commit/728113a3be690facad6ce436660a0bc1858017fa
CVE-2023-25672,TensorFlow is an open source platform for machine learning. The function `tf.raw_ops.LookupTableImportV2` cannot handle scalars in the `values` parameter and gives an NPE. A fix is included in TensorFlow version 2.12.0 and version 2.11.1.,,25-03-2023 00:15,https://github.com/tensorflow/tensorflow/commit/980b22536abcbbe1b4a5642fc940af33d8c19b69
CVE-2023-25671,TensorFlow is an open source platform for machine learning. There is out-of-bounds access due to mismatched integer type sizes. A fix is included in TensorFlow version 2.12.0 and version 2.11.1.,,25-03-2023 00:15,https://github.com/tensorflow/tensorflow/security/advisories/GHSA-j5w9-hmfh-4cr6
CVE-2023-25670,TensorFlow is an open source platform for machine learning. Versions prior to 2.12.0 and 2.11.1 have a null point error in QuantizedMatMulWithBiasAndDequantize with MKL enabled. A fix is included in TensorFlow version 2.12.0 and version 2.11.1.,,25-03-2023 00:15,https://github.com/tensorflow/tensorflow/commit/8a47a39d9697969206d23a523c977238717e8727
CVE-2023-25669,"TensorFlow is an open source platform for machine learning. Prior to versions 2.12.0 and 2.11.1, if the stride and window size are not positive for `tf.raw_ops.AvgPoolGrad`, it can give a floating point exception. A fix is included in TensorFlow version 2.12.0 and version 2.11.1.",,25-03-2023 00:15,https://github.com/tensorflow/tensorflow/security/advisories/GHSA-rcf8-g8jv-vg6p
CVE-2023-25668,"TensorFlow is an open source platform for machine learning. Attackers using Tensorflow prior to 2.12.0 or 2.11.1 can access heap memory which is not in the control of user, leading to a crash or remote code execution. The fix will be included in TensorFlow version 2.12.0 and will also cherrypick this commit on TensorFlow version 2.11.1.",,25-03-2023 00:15,https://github.com/tensorflow/tensorflow/commit/7b174a0f2e40ff3f3aa957aecddfd5aaae35eccb
