CVE ID,Description,CVSS,Date,References
CVE-2023-25667,"TensorFlow is an open source platform for machine learning. Prior to versions 2.12.0 and 2.11.1, integer overflow occurs when `2^31 <= num_frames * height * width * channels < 2^32`, for example Full HD screencast of at least 346 frames. A fix is included in TensorFlow version 2.12.0 and version 2.11.1.",,25-03-2023 00:15,https://github.com/tensorflow/tensorflow/commit/8dc723fcdd1a6127d6c970bd2ecb18b019a1a58d
CVE-2023-25666,"TensorFlow is an open source platform for machine learning. Prior to versions 2.12.0 and 2.11.1, there is a floating point exception in AudioSpectrogram. A fix is included in TensorFlow version 2.12.0 and version 2.11.1.",,25-03-2023 00:15,https://github.com/tensorflow/tensorflow/security/advisories/GHSA-f637-vh3r-vfh2
CVE-2023-25665,"TensorFlow is an open source platform for machine learning. Prior to versions 2.12.0 and 2.11.1, when `SparseSparseMaximum` is given invalid sparse tensors as inputs, it can give a null pointer error. A fix is included in TensorFlow version 2.12 and version 2.11.1.",,25-03-2023 00:15,https://github.com/tensorflow/tensorflow/security/advisories/GHSA-558h-mq8x-7q9g
CVE-2023-25664,"TensorFlow is an open source platform for machine learning. Prior to versions 2.12.0 and 2.11.1, there is a heap buffer overflow in TAvgPoolGrad. A fix is included in TensorFlow 2.12.0 and 2.11.1.",,25-03-2023 00:15,https://github.com/tensorflow/tensorflow/security/advisories/GHSA-6hg6-5c2q-7rcr
CVE-2023-25663,"TensorFlow is an open source platform for machine learning. Prior to versions 2.12.0 and 2.11.1, when `ctx->step_containter()` is a null ptr, the Lookup function will be executed with a null pointer. A fix is included in TensorFlow 2.12.0 and 2.11.1.",,25-03-2023 00:15,https://github.com/tensorflow/tensorflow/commit/239139d2ae6a81ae9ba499ad78b56d9b2931538a
CVE-2023-25662,TensorFlow is an open source platform for machine learning. Versions prior to 2.12.0 and 2.11.1 are vulnerable to integer overflow in EditDistance. A fix is included in TensorFlow version 2.12.0 and version 2.11.1.,,25-03-2023 00:15,https://github.com/tensorflow/tensorflow/commit/08b8e18643d6dcde00890733b270ff8d9960c56c
CVE-2023-25660,"TensorFlow is an open source platform for machine learning. Prior to versions 2.12.0 and 2.11.1, when the parameter `summarize` of `tf.raw_ops.Print` is zero, the new method `SummarizeArray<bool>` will reference to a nullptr, leading to a seg fault. A fix is included in TensorFlow version 2.12 and version 2.11.1.",,25-03-2023 00:15,https://github.com/tensorflow/tensorflow/commit/6d423b8bcc9aa9f5554dc988c1c16d038b508df1
CVE-2023-25659,"TensorFlow is an open source platform for machine learning. Prior to versions 2.12.0 and 2.11.1, if the parameter `indices` for `DynamicStitch` does not match the shape of the parameter `data`, it can trigger an stack OOB read. A fix is included in TensorFlow version 2.12.0 and version 2.11.1.",,25-03-2023 00:15,https://github.com/tensorflow/tensorflow/commit/ee004b18b976eeb5a758020af8880236cd707d05
CVE-2023-25658,"TensorFlow is an open source platform for machine learning. Prior to versions 2.12.0 and 2.11.1, an out of bounds read is in GRUBlockCellGrad. A fix is included in TensorFlow 2.12.0 and 2.11.1.",,25-03-2023 00:15,https://github.com/tensorflow/tensorflow/security/advisories/GHSA-68v3-g9cm-rmm6
CVE-2023-27042,Tenda AX3 V16.03.12.11 is vulnerable to Buffer Overflow via /goform/SetFirewallCfg.,,24-03-2023 23:15,https://github.com/hujianjie123/vuln/blob/main/Tenda/SetFirewallCfg/readme.md
CVE-2023-23149,DEK-1705 <=Firmware:34.23.1 device was discovered to have a command execution vulnerability.,,24-03-2023 23:15,https://gist.github.com/yinfei6/5430dc75683c642b7dc09e61c21a4ef4
CVE-2022-45597,ComponentSpace.Saml2 4.4.0 Missing SSL Certificate Validation.,,24-03-2023 23:15,https://www.componentspace.com/documentation/saml-for-asp-net-core/ComponentSpace%20SAML%20for%20ASP.NET%20Core%20Release%20Notes.pdf
CVE-2023-28150,An issue was discovered in Independentsoft JODF before 1.1.110. The API is prone to XML external entity (XXE) injection via a remote DTD in a DOCX file.,,24-03-2023 22:15,https://www.independentsoft.de/jword/index.html
CVE-2023-27055,Aver Information Inc PTZApp2 v20.01044.48 allows attackers to access sensitive files via a crafted GET request.,,24-03-2023 22:15,https://github.com/StolidWaffle/AVer-PTZApp2
CVE-2023-26864,SQL injection vulnerability found in PrestaShop smplredirectionsmanager v.1.1.19 and before allow a remote attacker to gain privileges via the SmplTools::getMatchingRedirectionsFromPartscomponent.,,24-03-2023 22:15,https://friends-of-presta.github.io/security-advisories/modules/2023/01/17/smplredirectionsmanager.html
CVE-2023-1583,"A NULL pointer dereference was found in io_file_bitmap_get in io_uring/filetable.c in the io_uring sub-component in the Linux Kernel. When fixed files are unregistered, some context information (file_alloc_{start,end} and alloc_hint) is not cleared. A subsequent request that has auto index selection enabled via IORING_FILE_INDEX_ALLOC can cause a NULL pointer dereference. An unprivileged user can use the flaw to cause a system crash.",,24-03-2023 22:15,https://git.kernel.org/pub/scm/linux/kernel/git/axboe/linux-block.git/commit/?h=io_uring-6.3&id=761efd55a0227aca3a69deacdaa112fffd44fe37
CVE-2023-28435,"Dataease is an open source data visualization and analysis tool. The permissions for the file upload interface is not checked so users who are not logged in can upload directly to the background. The file type also goes unchecked, users could upload any type of file. These vulnerabilities has been fixed in version 1.18.5.",,24-03-2023 21:15,https://github.com/dataease/dataease/issues/4798
CVE-2023-28448,"Versionize is a framework for version tolerant serializion/deserialization of Rust data structures, designed for usecases that need fast deserialization times and minimal size overhead. An issue was discovered in the ‘Versionize::deserialize’ implementation provided by the ‘versionize’ crate for ‘vmm_sys_utils::fam::FamStructWrapper', which can lead to out of bounds memory accesses. The impact started with version 0.1.1. The issue was corrected in version 0.1.10 by inserting a check that verifies, for any deserialized header, the lengths of compared flexible arrays are equal and aborting deserialization otherwise.",,24-03-2023 20:15,https://github.com/firecracker-microvm/versionize/pull/53
CVE-2023-28446,"Deno is a simple, modern and secure runtime for JavaScript and TypeScript that uses V8 and is built in Rust. Arbitrary program names without any ANSI filtering allows any malicious program to clear the first 2 lines of a `op_spawn_child` or `op_kill` prompt and replace it with any desired text. This works with any command on the respective platform, giving the program the full ability to choose what program they wanted to run. This problem can not be exploited on systems that do not attach an interactive prompt (for example headless servers). This issue has been patched in version 1.31.2.",,24-03-2023 20:15,https://github.com/denoland/deno/blob/7d13d65468c37022f003bb680dfbddd07ea72173/runtime/js/40_process.js#L175
CVE-2023-28444,"angular-server-side-configuration helps configure an angular application at runtime on the server or in a docker container via environment variables. angular-server-side-configuration detects used environment variables in TypeScript (.ts) files during build time of an Angular CLI project. The detected environment variables are written to a ngssc.json file in the output directory. During deployment of an Angular based app, the environment variables based on the variables from ngssc.json are inserted into the apps index.html (or defined index file). With version 15.0.0 the environment variable detection was widened to the entire project, relative to the angular.json file from the Angular CLI. In a monorepo setup, this could lead to environment variables intended for a backend/service to be detected and written to the ngssc.json, which would then be populated and exposed via index.html. This has NO IMPACT, in a plain Angular project that has no backend component. This vulnerability has been mitigated in version 15.1.0, by adding an option `searchPattern` which restricts the detection file range by default. As a workaround, manually edit or create ngssc.json or run script after ngssc.json generation.",,24-03-2023 20:15,https://github.com/kyubisation/angular-server-side-configuration/releases/tag/v15.1.0
CVE-2023-28151,An issue was discovered in Independentsoft JSpreadsheet before 1.1.110. The API is prone to XML external entity (XXE) injection via a remote DTD in a DOCX file.,,24-03-2023 20:15,https://www.independentsoft.de/jword/index.html
CVE-2023-25350,"Faveo Helpdesk 1.0-1.11.1 is vulnerable to SQL Injection. When the user logs in through the login box, he has no judgment on the validity of the user's input data. The parameters passed from the front end to the back end are controllable, which will lead to SQL injection.",,24-03-2023 20:15,https://github.com/ladybirdweb/faveo-helpdesk/issues/7827
CVE-2023-22812,SanDisk PrivateAccess versions prior to 6.4.9 support insecure TLS 1.0 and TLS 1.1 protocols which are susceptible to man-in-the-middle attacks thereby compromising confidentiality and integrity of data.,,24-03-2023 20:15,https://www.westerndigital.com/support/product-security/wdc-23005-sandisk-privateaccess-software-update
CVE-2023-21079,"In rtt_unpack_xtlv_cbfn of dhd_rtt.c, there is a possible out of bounds write due to a heap buffer overflow. This could lead to local escalation of privilege with System execution privileges needed. User interaction is not needed for exploitation.Product: AndroidVersions: Android kernelAndroid ID: A-254839721References: N/A",,24-03-2023 20:15,https://source.android.com/security/bulletin/pixel/2023-03-01
CVE-2023-21078,"In rtt_unpack_xtlv_cbfn of dhd_rtt.c, there is a possible out of bounds write due to a buffer overflow. This could lead to local escalation of privilege with System execution privileges needed. User interaction is not needed for exploitation.Product: AndroidVersions: Android kernelAndroid ID: A-254840211References: N/A",,24-03-2023 20:15,https://source.android.com/security/bulletin/pixel/2023-03-01
CVE-2023-21077,"In rtt_unpack_xtlv_cbfn of dhd_rtt.c, there is a possible out of bounds write due to a buffer overflow. This could lead to local escalation of privilege with System execution privileges needed. User interaction is not needed for exploitation.Product: AndroidVersions: Android kernelAndroid ID: A-257289560References: N/A",,24-03-2023 20:15,https://source.android.com/security/bulletin/pixel/2023-03-01
CVE-2023-21076,"In createTransmitFollowupRequest of nan.cpp, there is a possible out of bounds write due to a heap buffer overflow. This could lead to local escalation of privilege with System execution privileges needed. User interaction is not needed for exploitation.Product: AndroidVersions: Android kernelAndroid ID: A-261857623References: N/A",,24-03-2023 20:15,https://source.android.com/security/bulletin/pixel/2023-03-01
CVE-2023-21075,"In get_svc_hash of nan.cpp, there is a possible out of bounds write due to a heap buffer overflow. This could lead to local escalation of privilege with System execution privileges needed. User interaction is not needed for exploitation.Product: AndroidVersions: Android kernelAndroid ID: A-261857862References: N/A",,24-03-2023 20:15,https://source.android.com/security/bulletin/pixel/2023-03-01
CVE-2023-21073,"In rtt_unpack_xtlv_cbfn of dhd_rtt.c, there is a possible out of bounds write due to a buffer overflow. This could lead to local escalation of privilege with System execution privileges needed. User interaction is not needed for exploitation.Product: AndroidVersions: Android kernelAndroid ID: A-257290396References: N/A",,24-03-2023 20:15,https://source.android.com/security/bulletin/pixel/2023-03-01
CVE-2023-21072,"In rtt_unpack_xtlv_cbfn of dhd_rtt.c, there is a possible out of bounds write due to a buffer overflow. This could lead to local escalation of privilege with System execution privileges needed. User interaction is not needed for exploitation.Product: AndroidVersions: Android kernelAndroid ID: A-257290781References: N/A",,24-03-2023 20:15,https://source.android.com/security/bulletin/pixel/2023-03-01
CVE-2023-21071,"In dhd_prot_ioctcmplt_process of dhd_msgbuf.c, there is a possible out of bounds write due to improper input validation. This could lead to local escalation of privilege with System execution privileges needed. User interaction is not needed for exploitation.Product: AndroidVersions: Android kernelAndroid ID: A-254028518References: N/A",,24-03-2023 20:15,https://source.android.com/security/bulletin/pixel/2023-03-01
CVE-2023-21070,"In add_roam_cache_list of wl_roam.c, there is a possible out of bounds write due to a missing bounds check. This could lead to local escalation of privilege with System execution privileges needed. User interaction is not needed for exploitation.Product: AndroidVersions: Android kernelAndroid ID: A-254028776References: N/A",,24-03-2023 20:15,https://source.android.com/security/bulletin/pixel/2023-03-01
CVE-2023-21069,"In wl_update_hidden_ap_ie of wl_cfgscan.c, there is a possible out of bounds write due to a missing bounds check. This could lead to local escalation of privilege with System execution privileges needed. User interaction is not needed for exploitation.Product: AndroidVersions: Android kernelAndroid ID: A-254029309References: N/A",,24-03-2023 20:15,https://source.android.com/security/bulletin/pixel/2023-03-01
CVE-2023-21068,"In (TBD) of (TBD), there is a possible way to boot with a hidden debug policy due to a missing warning to the user. This could lead to local escalation of privilege after preparing the device, hiding the warning, and passing the phone to a new user, with no additional execution privileges needed. User interaction is not needed for exploitation.Product: AndroidVersions: Android kernelAndroid ID: A-243433344References: N/A",,24-03-2023 20:15,https://source.android.com/security/bulletin/pixel/2023-03-01
CVE-2023-21067,Product: AndroidVersions: Android kernelAndroid ID: A-254114726References: N/A,,24-03-2023 20:15,https://source.android.com/security/bulletin/pixel/2023-03-01
CVE-2023-21065,"In fdt_next_tag of fdt.c, there is a possible out of bounds write due to an integer overflow. This could lead to local escalation of privilege with System execution privileges needed. User interaction is not needed for exploitation.Product: AndroidVersions: Android kernelAndroid ID: A-239630493References: N/A",,24-03-2023 20:15,https://source.android.com/security/bulletin/pixel/2023-03-01
CVE-2023-21064,"In DoSetPinControl of miscservice.cpp, there is a possible out of bounds read due to a missing bounds check. This could lead to local escalation of privilege with System execution privileges needed. User interaction is not needed for exploitation.Product: AndroidVersions: Android kernelAndroid ID: A-243130078References: N/A",,24-03-2023 20:15,https://source.android.com/security/bulletin/pixel/2023-03-01
